{
  "schemaVersion": "1.0.0",
  "contentVersion": "1.0.0",
  "checksum": "812f63d923abd30ab785c6acf44c986e149c088e3f43c90f68718c68cc797d4f",
  "kind": "blueprint",
  "layer": {
    "module": "ui-blocks",
    "route": "header/gradient-orbit",
    "tenant": null,
    "role": null,
    "variant": null,
    "locale": "en-US"
  },
  "page": {
    "id": "ui-blocks-header-gradient-orbit",
    "title": "UI Block: Gradient orbit header",
    "regions": [
      {
        "id": "header",
        "components": [
          {
            "id": "header-gradient-orbit",
            "type": "HeaderSection",
            "props": {
              "variant": {
                "kind": "static",
                "value": "gradient-orbit"
              },
              "badge": {
                "kind": "static",
                "value": "New release"
              },
              "eyebrow": {
                "kind": "static",
                "value": "StewardTrack updates"
              },
              "headline": {
                "kind": "static",
                "value": "Blueprint Orbit is live"
              },
              "highlight": {
                "kind": "static",
                "value": "Product launch"
              },
              "description": {
                "kind": "static",
                "value": "Bring attention to a flagship release with a cinematic gradient header that cues the story and invites deeper exploration."
              },
              "highlights": {
                "kind": "binding",
                "source": "orbitHighlights",
                "path": "$"
              },
              "primaryCta": {
                "kind": "action",
                "actionId": "view-roadmap"
              },
              "secondaryCta": {
                "kind": "action",
                "actionId": "read-blog"
              }
            }
          }
        ]
      }
    ],
    "dataSources": [
      {
        "id": "orbitHighlights",
        "kind": "static",
        "config": {
          "value": [
            "Orchestrate product, marketing, and success milestones in one canvas",
            "Launch guided onboarding built from reusable blueprints",
            "Automate launch alerts directly into the channels your teams trust",
            "Measure activation with decision-ready dashboards"
          ]
        }
      }
    ],
    "actions": [
      {
        "id": "view-roadmap",
        "kind": "link",
        "config": {
          "Label": "View roadmap",
          "Url": "/product/roadmap",
          "Variant": "primary"
        }
      },
      {
        "id": "read-blog",
        "kind": "link",
        "config": {
          "Label": "Read launch brief",
          "Url": "/blog/blueprint-orbit-launch",
          "Variant": "secondary"
        }
      }
    ]
  },
  "sourcePath": "metadata\\authoring\\blueprints\\ui-blocks\\header-gradient-orbit.xml"
}
