{
  "schemaVersion": "1.0.0",
  "contentVersion": "1.0.0",
  "checksum": "e3a91ba1d03644e457062afd0265d258d4281376fc62e4c410ef5c8379178473",
  "kind": "blueprint",
  "layer": {
    "module": "ui-blocks",
    "route": "newsletter/spotlight",
    "tenant": null,
    "role": null,
    "variant": null,
    "locale": "en-US"
  },
  "page": {
    "id": "ui-blocks-newsletter-spotlight",
    "title": "UI Block: Newsletter testimonial spotlight",
    "regions": [
      {
        "id": "newsletter",
        "components": [
          {
            "id": "newsletter-spotlight",
            "type": "NewsletterSection",
            "props": {
              "variant": {
                "kind": "static",
                "value": "spotlight"
              },
              "badge": {
                "kind": "static",
                "value": "Executive brief"
              },
              "headline": {
                "kind": "static",
                "value": "One email leaders actually read"
              },
              "description": {
                "kind": "static",
                "value": "Summaries tailored for VPs and founders who want proof that metadata-led teams ship faster and stay aligned."
              },
              "testimonials": {
                "kind": "binding",
                "source": "spotlightTestimonial",
                "path": "items"
              },
              "logos": {
                "kind": "binding",
                "source": "spotlightLogos",
                "path": "items"
              },
              "form": {
                "kind": "binding",
                "source": "spotlightForm",
                "path": "$"
              }
            }
          }
        ]
      }
    ],
    "dataSources": [
      {
        "id": "spotlightTestimonial",
        "kind": "static",
        "config": {
          "value": {
            "items": [
              {
                "quote": "The executive brief gives me a board-ready read on how metadata is powering our customer experience.",
                "author": "Morgan Hayes",
                "role": "Chief Product Officer, Verse"
              }
            ]
          }
        }
      },
      {
        "id": "spotlightLogos",
        "kind": "static",
        "config": {
          "value": {
            "items": [
              "Verse",
              "Paragon",
              "Haystack",
              "Vanta"
            ]
          }
        }
      },
      {
        "id": "spotlightForm",
        "kind": "static",
        "config": {
          "value": {
            "placeholder": "leader@company.com",
            "buttonLabel": "Send the brief",
            "disclaimer": "Arrives Sunday evening with metrics and talking points.",
            "url": "/newsletter/executive-brief/subscribe"
          }
        }
      }
    ]
  },
  "sourcePath": "metadata\\authoring\\blueprints\\ui-blocks\\newsletter-spotlight.xml"
}
