{
  "schemaVersion": "1.0.0",
  "contentVersion": "1.0.0",
  "checksum": "521a6f9f0d1dce244cdef37f0265e425d686ac3c4bafb594ff39b4b5fa0b3ef5",
  "kind": "blueprint",
  "layer": {
    "module": "ui-blocks",
    "route": "stats/global-reach",
    "tenant": null,
    "role": null,
    "variant": null,
    "locale": "en-US"
  },
  "page": {
    "id": "ui-blocks-stats-global-reach",
    "title": "UI Block: Stats - Global reach",
    "regions": [
      {
        "id": "stats",
        "components": [
          {
            "id": "stats-global-reach",
            "type": "StatsSection",
            "props": {
              "variant": {
                "kind": "static",
                "value": "split-emphasis"
              },
              "eyebrow": {
                "kind": "static",
                "value": "Global presence"
              },
              "headline": {
                "kind": "static",
                "value": "Reach every customer with localized confidence"
              },
              "description": {
                "kind": "static",
                "value": "Showcase adoption, momentum, and satisfaction in every region with a narrative that sales and success teams can rely on."
              },
              "metrics": {
                "kind": "binding",
                "source": "reachMetrics",
                "path": "items"
              },
              "highlights": {
                "kind": "binding",
                "source": "reachHighlights",
                "path": "items"
              },
              "primaryCta": {
                "kind": "action",
                "actionId": "view-playbooks"
              },
              "secondaryCta": {
                "kind": "action",
                "actionId": "open-map"
              }
            }
          }
        ]
      }
    ],
    "dataSources": [
      {
        "id": "reachMetrics",
        "kind": "static",
        "config": {
          "value": {
            "items": [
              {
                "label": "Global active customers",
                "value": "182K",
                "description": "Monthly active organizations across self-serve and enterprise plans."
              },
              {
                "label": "Monthly signups",
                "value": "12.4K",
                "change": "+19%",
                "changeLabel": "MoM",
                "description": "New accounts onboarding each month."
              },
              {
                "label": "Enterprise accounts",
                "value": "640",
                "change": "+44",
                "changeLabel": "QoQ",
                "description": "Customers deploying at least 1K seats globally."
              },
              {
                "label": "Net promoter score",
                "value": "67",
                "change": "+6 pts",
                "changeLabel": "YoY",
                "description": "Composite NPS across top 10 regions."
              }
            ]
          }
        }
      },
      {
        "id": "reachHighlights",
        "kind": "static",
        "config": {
          "value": {
            "items": [
              "Localized experiences in 26 languages",
              "Regional success architects in 14 markets",
              "In-product billing across 9 currencies"
            ]
          }
        }
      }
    ],
    "actions": [
      {
        "id": "view-playbooks",
        "kind": "link",
        "config": {
          "Label": "View regional playbooks",
          "Url": "/customers/global-playbooks",
          "Variant": "primary"
        }
      },
      {
        "id": "open-map",
        "kind": "link",
        "config": {
          "Label": "Open customer map",
          "Url": "/customers/map",
          "Variant": "secondary"
        }
      }
    ]
  },
  "sourcePath": "metadata\\authoring\\blueprints\\ui-blocks\\stats-global-reach.xml"
}
