{
  "schemaVersion": "1.0.0",
  "contentVersion": "2.0.0",
  "checksum": "d4b0a6f67a7e15825772bd57b843b71092f630e4d3973e5228302924be9a6891",
  "kind": "blueprint",
  "layer": {
    "module": "ui-blocks",
    "route": "hero/newsletter",
    "tenant": null,
    "role": null,
    "variant": null,
    "locale": "en-US"
  },
  "page": {
    "id": "ui-blocks-hero-newsletter",
    "title": "UI Block: Newsletter hero",
    "regions": [
      {
        "id": "hero",
        "components": [
          {
            "id": "hero-newsletter",
            "type": "HeroSection",
            "props": {
              "variant": {
                "kind": "static",
                "value": "newsletter"
              },
              "badge": {
                "kind": "static",
                "value": "Weekly insights"
              },
              "headline": {
                "kind": "static",
                "value": "Teach customers how you build with metadata"
              },
              "description": {
                "kind": "static",
                "value": "Pair your content series with a hero that focuses on education, highlights, and simple subscription flows."
              },
              "highlights": {
                "kind": "binding",
                "source": "newsletterHighlights",
                "path": "items"
              },
              "form": {
                "kind": "binding",
                "source": "newsletterForm",
                "path": "$"
              },
              "primaryCta": {
                "kind": "action",
                "actionId": "subscribe"
              },
              "secondaryCta": {
                "kind": "action",
                "actionId": "read-archive"
              }
            }
          }
        ]
      }
    ],
    "dataSources": [
      {
        "id": "newsletterHighlights",
        "kind": "static",
        "config": {
          "value": {
            "items": [
              "Frameworks for shipping metadata experiments.",
              "Playbooks from teams moving to blueprint-driven sites.",
              "Design patterns for marketing, docs, and success."
            ]
          }
        }
      },
      {
        "id": "newsletterForm",
        "kind": "static",
        "config": {
          "value": {
            "placeholder": "StewardTrack-fan@company.com",
            "buttonLabel": "Subscribe",
            "disclaimer": "We send one curated update each week.",
            "url": "/newsletter/join"
          }
        }
      }
    ],
    "actions": [
      {
        "id": "subscribe",
        "kind": "link",
        "config": {
          "Label": "Subscribe",
          "Url": "/newsletter/subscribe",
          "Variant": "primary"
        }
      },
      {
        "id": "read-archive",
        "kind": "link",
        "config": {
          "Label": "Read the archive",
          "Url": "/newsletter/archive",
          "Variant": "secondary"
        }
      }
    ]
  },
  "sourcePath": "metadata/authoring/blueprints/ui-blocks/hero-newsletter.xml"
}
