{
  "schemaVersion": "1.0.0",
  "contentVersion": "1.0.0",
  "checksum": "d7e028b1513fab625fcd4c34875d419425391ec44d3e58f628e907910995037f",
  "kind": "blueprint",
  "layer": {
    "module": "ui-blocks",
    "route": "stats/ai-adoption",
    "tenant": null,
    "role": null,
    "variant": null,
    "locale": "en-US"
  },
  "page": {
    "id": "ui-blocks-stats-ai-adoption",
    "title": "UI Block: Stats - AI adoption",
    "regions": [
      {
        "id": "stats",
        "components": [
          {
            "id": "stats-ai-adoption",
            "type": "StatsSection",
            "props": {
              "variant": {
                "kind": "static",
                "value": "momentum-stream"
              },
              "eyebrow": {
                "kind": "static",
                "value": "AI adoption"
              },
              "headline": {
                "kind": "static",
                "value": "Operationalize AI responsibly and at scale"
              },
              "description": {
                "kind": "static",
                "value": "Tell the story of how automation, governance, and performance come together across your AI portfolio."
              },
              "metrics": {
                "kind": "binding",
                "source": "aiMetrics",
                "path": "items"
              },
              "badges": {
                "kind": "binding",
                "source": "aiBadges",
                "path": "items"
              }
            }
          }
        ]
      }
    ],
    "dataSources": [
      {
        "id": "aiMetrics",
        "kind": "static",
        "config": {
          "value": {
            "items": [
              {
                "label": "Automations shipped",
                "value": "1,240",
                "change": "+34%",
                "changeLabel": "QoQ",
                "description": "Production AI workflows executed monthly."
              },
              {
                "label": "Inference latency",
                "value": "48 ms",
                "change": "-12 ms",
                "changeLabel": "YoY",
                "description": "Median response time across customer endpoints."
              },
              {
                "label": "Model accuracy",
                "value": "93.4%",
                "change": "+2.8 pts",
                "changeLabel": "Benchmark",
                "description": "Composite accuracy across 12 public datasets."
              },
              {
                "label": "Cost per task",
                "value": "$0.004",
                "change": "-18%",
                "changeLabel": "YoY",
                "description": "Average compute cost per task across tenants."
              },
              {
                "label": "Feature adoption",
                "value": "72%",
                "change": "+9 pts",
                "changeLabel": "Active users",
                "description": "Weekly active accounts using AI copilots."
              },
              {
                "label": "Governed prompts",
                "value": "18.6K",
                "change": "+41%",
                "changeLabel": "QoQ",
                "description": "Prompts reviewed and approved by compliance."
              }
            ]
          }
        }
      },
      {
        "id": "aiBadges",
        "kind": "static",
        "config": {
          "value": {
            "items": [
              "Responsible AI scorecard",
              "SOC 2 automation controls"
            ]
          }
        }
      }
    ]
  },
  "sourcePath": "metadata/authoring/blueprints/ui-blocks/stats-ai-adoption.xml"
}
