{
  "schemaVersion": "1.0.0",
  "contentVersion": "1.0.0",
  "checksum": "d906e4d4c41093308e00e77a33e0e271f05037b1953627e9bb1ae56bf4999ea7",
  "kind": "blueprint",
  "layer": {
    "module": "ui-blocks",
    "route": "newsletter/split",
    "tenant": null,
    "role": null,
    "variant": null,
    "locale": "en-US"
  },
  "page": {
    "id": "ui-blocks-newsletter-split",
    "title": "UI Block: Newsletter split spotlight",
    "regions": [
      {
        "id": "newsletter",
        "components": [
          {
            "id": "newsletter-split",
            "type": "NewsletterSection",
            "props": {
              "variant": {
                "kind": "static",
                "value": "split"
              },
              "badge": {
                "kind": "static",
                "value": "Weekly strategy"
              },
              "eyebrow": {
                "kind": "static",
                "value": "StewardTrack Revenue Review"
              },
              "headline": {
                "kind": "static",
                "value": "Grow faster with the Revenue Review"
              },
              "description": {
                "kind": "static",
                "value": "Every Tuesday we translate pipeline data into one-page growth plans. See what to automate, where to double down, and which motions to sunset."
              },
              "checklist": {
                "kind": "binding",
                "source": "splitChecklist",
                "path": "items"
              },
              "logos": {
                "kind": "binding",
                "source": "splitLogos",
                "path": "items"
              },
              "form": {
                "kind": "binding",
                "source": "splitForm",
                "path": "$"
              },
              "highlight": {
                "kind": "static",
                "value": "See exactly which experiments to run next."
              },
              "image": {
                "kind": "binding",
                "source": "splitImage",
                "path": "$"
              },
              "primaryCta": {
                "kind": "action",
                "actionId": "view-archive"
              },
              "secondaryCta": {
                "kind": "action",
                "actionId": "share-team"
              }
            }
          }
        ]
      }
    ],
    "dataSources": [
      {
        "id": "splitChecklist",
        "kind": "static",
        "config": {
          "value": {
            "items": [
              "Revenue-qualified experiment plans tailored to your stage.",
              "Signals from hundreds of B2B plays across the StewardTrack network.",
              "Templates for running impact reviews with your GTM pod."
            ]
          }
        }
      },
      {
        "id": "splitLogos",
        "kind": "static",
        "config": {
          "value": {
            "items": [
              "Atlas Labs",
              "Northwind",
              "Figma",
              "Metaplane"
            ]
          }
        }
      },
      {
        "id": "splitForm",
        "kind": "static",
        "config": {
          "value": {
            "placeholder": "ops-lead@company.com",
            "buttonLabel": "Join the briefing",
            "disclaimer": "Arrives every Tuesday. No fluff, just experiments that worked.",
            "url": "/newsletter/revenue-review/signup"
          }
        }
      },
      {
        "id": "splitImage",
        "kind": "static",
        "config": {
          "value": {
            "src": "https://images.unsplash.com/photo-1520607162513-77705c0f0d4a?auto=format&fit=crop&w=1200&q=80",
            "alt": "Revenue dashboard preview"
          }
        }
      }
    ],
    "actions": [
      {
        "id": "view-archive",
        "kind": "link",
        "config": {
          "Label": "View past issues",
          "Url": "/newsletter/revenue-review/archive",
          "Variant": "secondary"
        }
      },
      {
        "id": "share-team",
        "kind": "link",
        "config": {
          "Label": "Share with my team",
          "Url": "/newsletter/revenue-review/share",
          "Variant": "ghost"
        }
      }
    ]
  },
  "sourcePath": "metadata\\authoring\\blueprints\\ui-blocks\\newsletter-split.xml"
}
