{
  "schemaVersion": "1.0.0",
  "contentVersion": "1.0.0",
  "checksum": "347d2a8180d2d3d89687c3a00fcfbc220d39805b9f62d6e99967d83bc1fdb59e",
  "kind": "blueprint",
  "layer": {
    "module": "ui-blocks",
    "route": "newsletter/gallery",
    "tenant": null,
    "role": null,
    "variant": null,
    "locale": "en-US"
  },
  "page": {
    "id": "ui-blocks-newsletter-gallery",
    "title": "UI Block: Newsletter gallery showcase",
    "regions": [
      {
        "id": "newsletter",
        "components": [
          {
            "id": "newsletter-gallery",
            "type": "NewsletterSection",
            "props": {
              "variant": {
                "kind": "static",
                "value": "gallery"
              },
              "eyebrow": {
                "kind": "static",
                "value": "Sneak peek"
              },
              "headline": {
                "kind": "static",
                "value": "See blueprints before they ship"
              },
              "description": {
                "kind": "static",
                "value": "We capture metadata experiments in progress â€” prototypes, dashboards, and patterns headed to production."
              },
              "highlights": {
                "kind": "binding",
                "source": "galleryHighlights",
                "path": "items"
              },
              "gallery": {
                "kind": "binding",
                "source": "galleryImages",
                "path": "items"
              },
              "form": {
                "kind": "binding",
                "source": "galleryForm",
                "path": "$"
              }
            }
          }
        ]
      }
    ],
    "dataSources": [
      {
        "id": "galleryHighlights",
        "kind": "static",
        "config": {
          "value": {
            "items": [
              {
                "title": "Design snapshots",
                "description": "Peek at real Figma frames and experiment dashboards each week."
              },
              {
                "title": "Behind the scenes",
                "description": "Understand how teams wired metadata to power their latest launch."
              },
              {
                "title": "Field notes",
                "description": "Learn which instrumentation choices paid off (and which didn't)."
              }
            ]
          }
        }
      },
      {
        "id": "galleryImages",
        "kind": "static",
        "config": {
          "value": {
            "items": [
              {
                "src": "https://images.unsplash.com/photo-1545239351-1141bd82e8a6?auto=format&fit=crop&w=500&q=80",
                "alt": "Workspace"
              },
              {
                "src": "https://images.unsplash.com/photo-1522199994201-9e76f9a62d83?auto=format&fit=crop&w=500&q=80",
                "alt": "Dashboard"
              },
              {
                "src": "https://images.unsplash.com/photo-1526374965328-7f61d4dc18c5?auto=format&fit=crop&w=500&q=80",
                "alt": "Automation"
              },
              {
                "src": "https://images.unsplash.com/photo-1520607162513-77705c0f0d4a?auto=format&fit=crop&w=500&q=80",
                "alt": "Workflow"
              }
            ]
          }
        }
      },
      {
        "id": "galleryForm",
        "kind": "static",
        "config": {
          "value": {
            "placeholder": "designer@company.com",
            "buttonLabel": "Send the preview",
            "disclaimer": "Every Thursday. Includes annotated prototypes and notes.",
            "url": "/newsletter/gallery-preview/subscribe"
          }
        }
      }
    ]
  },
  "sourcePath": "metadata\\authoring\\blueprints\\ui-blocks\\newsletter-gallery.xml"
}
