{
  "schemaVersion": "1.0.0",
  "contentVersion": "1.0.0",
  "checksum": "59d7f9d829f9546943cd4eab736e5b806c5c82b84ecddff301eeefe427bb124b",
  "kind": "blueprint",
  "layer": {
    "module": "ui-blocks",
    "route": "stats/revenue-momentum",
    "tenant": null,
    "role": null,
    "variant": null,
    "locale": "en-US"
  },
  "page": {
    "id": "ui-blocks-stats-revenue-momentum",
    "title": "UI Block: Stats - Revenue momentum",
    "regions": [
      {
        "id": "stats",
        "components": [
          {
            "id": "stats-revenue-momentum",
            "type": "StatsSection",
            "props": {
              "variant": {
                "kind": "static",
                "value": "velocity-panel"
              },
              "eyebrow": {
                "kind": "static",
                "value": "Growth velocity"
              },
              "headline": {
                "kind": "static",
                "value": "Momentum across every GTM motion"
              },
              "description": {
                "kind": "static",
                "value": "Demonstrate disciplined revenue execution with the KPIs investors and revenue leaders follow every week."
              },
              "metrics": {
                "kind": "binding",
                "source": "revenueMetrics",
                "path": "items"
              },
              "highlights": {
                "kind": "binding",
                "source": "revenueHighlights",
                "path": "items"
              },
              "primaryCta": {
                "kind": "action",
                "actionId": "view-forecast"
              },
              "secondaryCta": {
                "kind": "action",
                "actionId": "share-update"
              }
            }
          }
        ]
      }
    ],
    "dataSources": [
      {
        "id": "revenueMetrics",
        "kind": "static",
        "config": {
          "value": {
            "items": [
              {
                "label": "Annual recurring revenue",
                "value": "$48M",
                "change": "+18%",
                "changeLabel": "QoQ",
                "description": "Driven by net-new platform subscriptions across enterprise and scale segments."
              },
              {
                "label": "Pipeline coverage",
                "value": "4.3x",
                "change": "+0.8x",
                "changeLabel": "vs target",
                "description": "Weighted pipeline coverage for the next two quarters."
              },
              {
                "label": "Expansion ARR",
                "value": "134%",
                "change": "+12 pts",
                "changeLabel": "NRR",
                "description": "Net revenue retention from existing customers."
              },
              {
                "label": "Enterprise win rate",
                "value": "46%",
                "change": "+5 pts",
                "changeLabel": "QoQ",
                "description": "Strategic deals over $100K closed with cross-functional pods."
              }
            ]
          }
        }
      },
      {
        "id": "revenueHighlights",
        "kind": "static",
        "config": {
          "value": {
            "items": [
              "Forecast accuracy locked at 96%",
              "Average sales cycle shortened to 42 days",
              "Partner-sourced revenue up 31%"
            ]
          }
        }
      }
    ],
    "actions": [
      {
        "id": "view-forecast",
        "kind": "link",
        "config": {
          "Label": "Review forecast",
          "Url": "/revenue/forecast",
          "Variant": "primary"
        }
      },
      {
        "id": "share-update",
        "kind": "link",
        "config": {
          "Label": "Share investor update",
          "Url": "/revenue/investor-brief",
          "Variant": "secondary"
        }
      }
    ]
  },
  "sourcePath": "metadata/authoring/blueprints/ui-blocks/stats-revenue-momentum.xml"
}
