{
  "schemaVersion": "1.0.0",
  "contentVersion": "1.0.0",
  "checksum": "cb6dfab82bf87356fa6d25b44c1d4ef938bef40d15d6a38d3877a355a2c1c9c8",
  "kind": "blueprint",
  "layer": {
    "module": "ui-blocks",
    "route": "stats/customer-trust",
    "tenant": null,
    "role": null,
    "variant": null,
    "locale": "en-US"
  },
  "page": {
    "id": "ui-blocks-stats-customer-trust",
    "title": "UI Block: Stats - Customer trust",
    "regions": [
      {
        "id": "stats",
        "components": [
          {
            "id": "stats-customer-trust",
            "type": "StatsSection",
            "props": {
              "variant": {
                "kind": "static",
                "value": "glow-grid"
              },
              "eyebrow": {
                "kind": "static",
                "value": "Customer trust"
              },
              "headline": {
                "kind": "static",
                "value": "Confidence metrics your buyers ask for"
              },
              "description": {
                "kind": "static",
                "value": "Answer diligence questionnaires in a single glance with audited platform metrics and independent attestations."
              },
              "metrics": {
                "kind": "binding",
                "source": "trustMetrics",
                "path": "items"
              },
              "badges": {
                "kind": "binding",
                "source": "trustBadges",
                "path": "items"
              },
              "footnote": {
                "kind": "static",
                "value": "Independent audit window: FY2024"
              },
              "primaryCta": {
                "kind": "action",
                "actionId": "view-trust"
              },
              "secondaryCta": {
                "kind": "action",
                "actionId": "download-kit"
              }
            }
          }
        ]
      }
    ],
    "dataSources": [
      {
        "id": "trustMetrics",
        "kind": "static",
        "config": {
          "value": {
            "items": [
              {
                "label": "Platform uptime",
                "value": "99.995%",
                "description": "Across all global regions during the last 12 months."
              },
              {
                "label": "Incident resolution",
                "value": "94% &lt;1h",
                "description": "Priority incidents resolved within the first hour."
              },
              {
                "label": "Customer retention",
                "value": "98%",
                "change": "+3 pts",
                "changeLabel": "YoY",
                "description": "Enterprise segment retention rate."
              },
              {
                "label": "Security reviews",
                "value": "28",
                "description": "Independent compliance assessments completed."
              },
              {
                "label": "Customer satisfaction",
                "value": "4.92 / 5",
                "description": "Average CSAT across 18k survey responses."
              },
              {
                "label": "Global coverage",
                "value": "14 regions",
                "description": "Active data residency zones maintained."
              }
            ]
          }
        }
      },
      {
        "id": "trustBadges",
        "kind": "static",
        "config": {
          "value": {
            "items": [
              "SOC 2 Type II",
              "ISO 27001",
              "GDPR ready"
            ]
          }
        }
      }
    ],
    "actions": [
      {
        "id": "view-trust",
        "kind": "link",
        "config": {
          "Label": "View trust portal",
          "Url": "/trust-center",
          "Variant": "primary"
        }
      },
      {
        "id": "download-kit",
        "kind": "link",
        "config": {
          "Label": "Download compliance kit",
          "Url": "/trust-center/resources",
          "Variant": "secondary"
        }
      }
    ]
  },
  "sourcePath": "metadata/authoring/blueprints/ui-blocks/stats-customer-trust.xml"
}
