{
  "schemaVersion": "1.0.0",
  "contentVersion": "1.0.0",
  "checksum": "233408c403bc57e1c6c5fbb1a00a7e0ca39ae48a6b43eb531ca75dfc590a82ce",
  "kind": "blueprint",
  "layer": {
    "module": "ui-blocks",
    "route": "newsletter/resource",
    "tenant": null,
    "role": null,
    "variant": null,
    "locale": "en-US"
  },
  "page": {
    "id": "ui-blocks-newsletter-resource",
    "title": "UI Block: Newsletter resource vault",
    "regions": [
      {
        "id": "newsletter",
        "components": [
          {
            "id": "newsletter-resource",
            "type": "NewsletterSection",
            "props": {
              "variant": {
                "kind": "static",
                "value": "resource"
              },
              "badge": {
                "kind": "static",
                "value": "Resource kit"
              },
              "headline": {
                "kind": "static",
                "value": "Unlock the metadata enablement vault"
              },
              "description": {
                "kind": "static",
                "value": "Every issue includes a guided lesson, worksheet, and video walkthrough so your team can master metadata workflows."
              },
              "checklist": {
                "kind": "binding",
                "source": "resourceChecklist",
                "path": "items"
              },
              "cards": {
                "kind": "binding",
                "source": "resourceCards",
                "path": "items"
              },
              "form": {
                "kind": "binding",
                "source": "resourceForm",
                "path": "$"
              }
            }
          }
        ]
      }
    ],
    "dataSources": [
      {
        "id": "resourceChecklist",
        "kind": "static",
        "config": {
          "value": {
            "items": [
              "Weekly lab to practice a metadata workflow.",
              "Downloadable worksheets for each lesson.",
              "Recordings with annotated blueprints."
            ]
          }
        }
      },
      {
        "id": "resourceCards",
        "kind": "static",
        "config": {
          "value": {
            "items": [
              {
                "badge": "Guide",
                "title": "Metadata maturity assessment",
                "description": "Score your current stack and prioritize the next three upgrades."
              },
              {
                "badge": "Worksheet",
                "title": "Schema change playbook",
                "description": "Coordinate product, docs, and go-to-market in one template."
              },
              {
                "badge": "Video",
                "title": "Experiment review clinic",
                "description": "See how a revenue team scaled experimentation using overlays."
              },
              {
                "badge": "Checklist",
                "title": "Lifecycle automation QA",
                "description": "Verify metadata accuracy before flipping on a new journey."
              }
            ]
          }
        }
      },
      {
        "id": "resourceForm",
        "kind": "static",
        "config": {
          "value": {
            "placeholder": "enablement@company.com",
            "buttonLabel": "Email me the kit",
            "disclaimer": "Delivered Sunday evening with lessons for the week ahead.",
            "url": "/newsletter/resource-vault/subscribe"
          }
        }
      }
    ]
  },
  "sourcePath": "metadata\\authoring\\blueprints\\ui-blocks\\newsletter-resource.xml"
}
